Раздел,Цель,Ключевой результат,Артефакты / документы,Комментарии
Intended Use / Claims,Снизить регуляторный риск,Claims без диагностики/назначений на старте,"Labeling v1, IFU, clinical context",Рекомендуется избегать «диагнозов» от AI.
Класс изделия (SaMD),Определить путь регистрации,US: Class II special controls; EU: Rule 11 обычно IIa; RU/CN: обычно >= II,Классификационные обоснования,Финальный класс зависит от intended use.
Клинические доказательства,Доказать сопоставимость с референсом,"Method comparison (Bland–Altman, MAE) + доля валидных измерений",Protocol + SAP + CSR,Сначала пилот -> затем пивот.
Software V&V,Доказать надежность и безопасность ПО,IEC 62304 подход + тест-матрикс,"SRS, RTM, Test Reports",Включая performance и cybersecurity.
Кибербезопасность и данные,Соблюдение требований регионов,On-device by default; региональные облака при необходимости,"Threat model, SBOM, security testing",Особенно важно для РФ (локализация).
